Running as user "root" and group "root". This could be dangerous.
Capturing on 'h2-eth0'
  112 1743439150.796808312     10.0.0.1 → 10.0.0.2     TCP 2962 [TCP Fast Retransmission] 53564 → 5001 [PSH, ACK] Seq=53577 Ack=1 Win=83 Len=2896 TSval=1943972094 TSecr=4068193142
 1268 1743439153.355188233     10.0.0.1 → 10.0.0.2     TCP 2962 [TCP Fast Retransmission] 53572 → 5001 [PSH, ACK] Seq=56533 Ack=29 Win=42496 Len=2896 TSval=1943974682 TSecr=4068195730
 2113 1743439154.402692268     10.0.0.1 → 10.0.0.2     TCP 2962 [TCP Fast Retransmission] 53572 → 5001 [PSH, ACK] Seq=1290229 Ack=29 Win=42496 Len=2896 TSval=1943975747 TSecr=4068196796
 2170 1743439154.506559351     10.0.0.1 → 10.0.0.2     TCP 2962 [TCP Fast Retransmission] 53572 → 5001 [PSH, ACK] Seq=1380005 Ack=29 Win=42496 Len=2896 TSval=1943975851 TSecr=4068196900
 2231 1743439155.746944443     10.0.0.1 → 10.0.0.2     TCP 1514 [TCP Fast Retransmission] 53584 → 5001 [ACK] Seq=11645 Ack=29 Win=42496 Len=1448 TSval=1943977091 TSecr=4068198140
 2811 1743439156.993002217     10.0.0.1 → 10.0.0.2     TCP 2962 [TCP Fast Retransmission] 53584 → 5001 [PSH, ACK] Seq=839901 Ack=29 Win=42496 Len=2896 TSval=1943978336 TSecr=4068199385
 3201 1743439158.693982506     10.0.0.1 → 10.0.0.2     TCP 2962 [TCP Fast Retransmission] 49510 → 5001 [PSH, ACK] Seq=349029 Ack=29 Win=42496 Len=2896 TSval=1943979899 TSecr=4068200947
 4397 1743439160.668404584     10.0.0.1 → 10.0.0.2     TCP 2962 [TCP Fast Retransmission] 49510 → 5001 [PSH, ACK] Seq=2163373 Ack=29 Win=42496 Len=2896 TSval=1943982012 TSecr=4068203058
 4695 1743439162.340868253     10.0.0.1 → 10.0.0.2     TCP 2962 [TCP Fast Retransmission] 49520 → 5001 [PSH, ACK] Seq=136173 Ack=29 Win=42496 Len=2896 TSval=1943983601 TSecr=4068204649
 4831 1743439162.501298916     10.0.0.1 → 10.0.0.2     TCP 1514 [TCP Fast Retransmission] 49520 → 5001 [ACK] Seq=367853 Ack=29 Win=42496 Len=1448 TSval=1943983800 TSecr=4068204848
 5839 1743439163.765148633     10.0.0.1 → 10.0.0.2     TCP 2962 [TCP Fast Retransmission] 49520 → 5001 [PSH, ACK] Seq=1863637 Ack=29 Win=42496 Len=2896 TSval=1943985103 TSecr=4068206151
 6360 1743439165.637051538     10.0.0.1 → 10.0.0.2     TCP 2962 [TCP Fast Retransmission] 49526 → 5001 [PSH, ACK] Seq=511205 Ack=29 Win=42496 Len=2896 TSval=1943986824 TSecr=4068207872
 6575 1743439165.873133049     10.0.0.1 → 10.0.0.2     TCP 1514 [TCP Fast Retransmission] 49526 → 5001 [ACK] Seq=860173 Ack=29 Win=42496 Len=1448 TSval=1943987120 TSecr=4068208169
 7061 1743439166.429086132     10.0.0.1 → 10.0.0.2     TCP 2962 [TCP Fast Retransmission] 49526 → 5001 [PSH, ACK] Seq=1630509 Ack=29 Win=42496 Len=2896 TSval=1943987767 TSecr=4068208816
 7214 1743439166.645402563     10.0.0.1 → 10.0.0.2     TCP 2962 [TCP Fast Retransmission] 49526 → 5001 [PSH, ACK] Seq=1862189 Ack=29 Win=42496 Len=2896 TSval=1943987989 TSecr=4068209037
 7248 1743439166.708691084     10.0.0.1 → 10.0.0.2     TCP 1514 [TCP Fast Retransmission] 49526 → 5001 [ACK] Seq=1915765 Ack=29 Win=42496 Len=1448 TSval=1943988053 TSecr=4068209102
 7878 1743439168.983004577     10.0.0.1 → 10.0.0.2     TCP 2962 [TCP Fast Retransmission] 48550 → 5001 [PSH, ACK] Seq=450389 Ack=29 Win=42496 Len=2896 TSval=1943990180 TSecr=4068211228
 8082 1743439169.207109752     10.0.0.1 → 10.0.0.2     TCP 1514 [TCP Fast Retransmission] 48550 → 5001 [ACK] Seq=784877 Ack=29 Win=42496 Len=1448 TSval=1943990462 TSecr=4068211509
 8588 1743439169.813171149     10.0.0.1 → 10.0.0.2     TCP 2962 [TCP Fast Retransmission] 48550 → 5001 [PSH, ACK] Seq=1571141 Ack=29 Win=42496 Len=2896 TSval=1943991130 TSecr=4068212179
 8972 1743439171.450729145     10.0.0.1 → 10.0.0.2     TCP 2962 [TCP Fast Retransmission] 48564 → 5001 [PSH, ACK] Seq=34813 Ack=29 Win=42496 Len=2896 TSval=1943992789 TSecr=4068213837
 9393 1743439172.225996140     10.0.0.1 → 10.0.0.2     TCP 2962 [TCP Fast Retransmission] 48564 → 5001 [PSH, ACK] Seq=656005 Ack=29 Win=42496 Len=2896 TSval=1943993568 TSecr=4068214616
10558 1743439175.110694218     10.0.0.1 → 10.0.0.2     TCP 2962 [TCP Fast Retransmission] 48572 → 5001 [PSH, ACK] Seq=1117917 Ack=29 Win=42496 Len=2896 TSval=1943996277 TSecr=4068217326
11258 1743439175.949581808     10.0.0.1 → 10.0.0.2     TCP 2962 [TCP Fast Retransmission] 48572 → 5001 [PSH, ACK] Seq=2222741 Ack=29 Win=42496 Len=2896 TSval=1943997222 TSecr=4068218269
11846 1743439177.855928111     10.0.0.1 → 10.0.0.2     TCP 2962 [TCP Fast Retransmission] 38252 → 5001 [PSH, ACK] Seq=422877 Ack=29 Win=42496 Len=2896 TSval=1943999125 TSecr=4068220173
11944 1743439177.958377033     10.0.0.1 → 10.0.0.2     TCP 1514 [TCP Fast Retransmission] 38252 → 5001 [ACK] Seq=586501 Ack=29 Win=42496 Len=1448 TSval=1943999265 TSecr=4068220313
12444 1743439178.556397248     10.0.0.1 → 10.0.0.2     TCP 1514 [TCP Fast Retransmission] 38252 → 5001 [ACK] Seq=1322085 Ack=29 Win=42496 Len=1448 TSval=1943999882 TSecr=4068220931
12704 1743439178.865489676     10.0.0.1 → 10.0.0.2     TCP 1514 [TCP Fast Retransmission] 38252 → 5001 [ACK] Seq=1707253 Ack=29 Win=42496 Len=1448 TSval=1944000209 TSecr=4068221256
12761 1743439178.953780250     10.0.0.1 → 10.0.0.2     TCP 2962 [TCP Fast Retransmission] 38252 → 5001 [PSH, ACK] Seq=1795581 Ack=29 Win=42496 Len=2896 TSval=1944000296 TSecr=4068221345
12975 1743439180.396348486     10.0.0.1 → 10.0.0.2     TCP 2962 [TCP Fast Retransmission] 38256 → 5001 [PSH, ACK] Seq=150653 Ack=29 Win=42496 Len=2896 TSval=1944001645 TSecr=4068222693
13098 1743439180.540793044     10.0.0.1 → 10.0.0.2     TCP 1514 [TCP Fast Retransmission] 38256 → 5001 [ACK] Seq=370749 Ack=29 Win=42496 Len=1448 TSval=1944001831 TSecr=4068222879
14759 1743439183.921714501     10.0.0.1 → 10.0.0.2     TCP 2962 [TCP Fast Retransmission] 38258 → 5001 [PSH, ACK] Seq=808045 Ack=29 Win=42496 Len=2896 TSval=1944005101 TSecr=4068226149
15520 1743439184.771821340     10.0.0.1 → 10.0.0.2     TCP 2962 [TCP Fast Retransmission] 38258 → 5001 [PSH, ACK] Seq=1970789 Ack=29 Win=42496 Len=2896 TSval=1944006082 TSecr=4068227130
15646 1743439184.933881278     10.0.0.1 → 10.0.0.2     TCP 2962 [TCP Fast Retransmission] 38258 → 5001 [PSH, ACK] Seq=2182197 Ack=29 Win=42496 Len=2896 TSval=1944006270 TSecr=4068227318
15672 1743439184.963480980     10.0.0.1 → 10.0.0.2     TCP 1514 [TCP Fast Retransmission] 38258 → 5001 [ACK] Seq=2228533 Ack=29 Win=42496 Len=1448 TSval=1944006307 TSecr=4068227354
16054 1743439186.634770281     10.0.0.1 → 10.0.0.2     TCP 2962 [TCP Fast Retransmission] 49390 → 5001 [PSH, ACK] Seq=165133 Ack=29 Win=42496 Len=2896 TSval=1944007872 TSecr=4068228921
17166 1743439189.291714831     10.0.0.1 → 10.0.0.2     TCP 2962 [TCP Fast Retransmission] 49402 → 5001 [PSH, ACK] Seq=24677 Ack=29 Win=42496 Len=2896 TSval=1944010625 TSecr=4068231671
18098 1743439201.456735619     10.0.0.1 → 10.0.0.2     TCP 2962 [TCP Fast Retransmission] 42724 → 5001 [PSH, ACK] Seq=444597 Ack=29 Win=42496 Len=2896 TSval=1944022658 TSecr=4068243705
18885 1743439202.366779591     10.0.0.1 → 10.0.0.2     TCP 2962 [TCP Fast Retransmission] 42724 → 5001 [PSH, ACK] Seq=1660917 Ack=29 Win=42496 Len=2896 TSval=1944023683 TSecr=4068244731
19391 1743439204.185386102     10.0.0.1 → 10.0.0.2     TCP 2962 [TCP Fast Retransmission] 42740 → 5001 [PSH, ACK] Seq=212917 Ack=29 Win=42496 Len=2896 TSval=1944025398 TSecr=4068246446
20888 1743439207.439313471     10.0.0.1 → 10.0.0.2     TCP 2962 [TCP Fast Retransmission] 54550 → 5001 [PSH, ACK] Seq=130381 Ack=29 Win=42496 Len=2896 TSval=1944028709 TSecr=4068249758
20961 1743439207.518098399     10.0.0.1 → 10.0.0.2     TCP 2962 [TCP Fast Retransmission] 54550 → 5001 [PSH, ACK] Seq=269389 Ack=29 Win=42496 Len=2896 TSval=1944028823 TSecr=4068249870
22693 1743439210.947702792     10.0.0.1 → 10.0.0.2     TCP 2962 [TCP Fast Retransmission] 54556 → 5001 [PSH, ACK] Seq=928229 Ack=29 Win=42496 Len=2896 TSval=1944032126 TSecr=4068253175
22851 1743439211.109340620     10.0.0.1 → 10.0.0.2     TCP 2962 [TCP Fast Retransmission] 54556 → 5001 [PSH, ACK] Seq=1196109 Ack=29 Win=42496 Len=2896 TSval=1944032352 TSecr=4068253399
23200 1743439211.534263352     10.0.0.1 → 10.0.0.2     TCP 2962 [TCP Fast Retransmission] 54556 → 500146 packets captured
 [PSH, ACK] Seq=1746349 Ack=29 Win=42496 Len=2896 TSval=1944032815 TSecr=4068253862
23247 1743439211.579319105     10.0.0.1 → 10.0.0.2     TCP 2962 [TCP Fast Retransmission] 54556 → 5001 [PSH, ACK] Seq=1828885 Ack=29 Win=42496 Len=2896 TSval=1944032882 TSecr=4068253929
23327 1743439211.669577534     10.0.0.1 → 10.0.0.2     TCP 2962 [TCP Fast Retransmission] 54556 → 5001 [PSH, ACK] Seq=1944725 Ack=29 Win=42496 Len=2896 TSval=1944032985 TSecr=4068254033
